TweetId,Label,cleaned_text
303409977362628609,Sports,tommyhaas up to no  nalbandiandavid rises  spots to no  latest emiratesatprankings  atp tennis
291459518905331713,Sports,scorchersbbl win the toss and bowl first yep thats james faulkner bbl bigfinals 
303301223770103808,Sports,buy a streets icecream from a united petroleum service station for chance to win an f seater ride at the ausgp 
294024941261713408,Politics,india africa a shared future is at davos 
292605683650662400,Sports,out katich caught at cover without troubling the scorers off roach   off  needed bbl bigfinals
305637328561524736,Politics,visited the national philatelic exhibition at world trade center runs till feb th organized by india post 
306083872255406080,Sports,had dinner with wasim akram who has quit as kkr mentor wants to spend more time with his kids wont do commentary for next  tests too
304652597040644096,Sports,big night at the bridge atmosphere starting to build around the ground cfc
261133532301254656,Politics,were going to bring this country back 
23917695573,Sports,sunderland manager steve bruce has told reporters he will not be making any more wholesale additions to his squad this season
296822421766422529,Sports,lizlau  fanlove
305920627716530176,Sports,out watson out on the stroke of lunch an ashwin delivery bounces high catches the shoulder and is caught aus  indvaus
304454724428632064,Sports,breakfast with the great cricketer kapil dev revolved aroundgolf sometimes i wonder which is his bigger passion
305971426597412864,Sports,out siddle is clean bowled by jadeja going for the big sweep out for   indvaus
306064568944312320,Politics,sarkarswati  fair enough
303762263687454721,Politics,government again appeals to the bank employees not to join the strike on  february  visit pibs website 
278858541224316930,Politics,president interference with domestic political processes is unacceptable those receiving money from abroad cannot be politicians in russia
277090243373584384,Politics,medvedev im willing to speak with any political force the question is whether the movement is ready to take on responsibility
306480734372249601,Sports,swansea chairman huw jenkins on michael laudrups future i hope that michaels here for a few years yet hes cemented his roots here
306720522941657089,Sports,vic need  to win  balls  wickets in hand catch the nailbiting ryobi oneday cup final action 
306665713047842816,Politics,finance minister shri p chidambaram presents the economic survey  in lok sabha today
283097945165946880,Politics,meeting one of csls  workers responsible for building indias first indigenous aircraft carrier 
271518461837058048,Politics,video in english press conference by chief cabinet secretary fujimura november  amn
301620681488080897,Politics,down under ep holds th interparliamentary meeting in australia about energy resources agriculture fisheries amp trade with eu
301530473925050368,Politics,it remains the task of us all as citizens of these united states to be the authors of the next great chapter in our american story
301195770139402241,Sports,lachlan single day grandstand tix for sun are sold out have you considered our premium zones heres some info 
304591158921818113,Politics,buzkashi boys star mohammadi is proud for afghanistan the first oscar for afghanistan afghanprogress nbcnews
292605274940915712,Sports,roach to bowl the third last over bbl bigfinals
293448060443426816,Politics,todays inauguration is a starstudded affair and these celebs arent just bystanders theyve been active pu 
301917805169741825,Sports,rt daintydimwit sir p g wodehouse i love you i always have deathanniv
306771612601028608,Sports,david beckham will make his first start for paris stgermain in their coupe de france clash with marseille tonight 
301512142836875264,Politics,tony bennett and ted nugent in the audience for the state of the union item  sotu
302590134400991233,Sports,federer backs squash for olympics amp met womens world no  nicoldavid pic h koster  atp 
278760284829663232,Politics,the cell is an ideal place to learn to know yourself to search realistically amp regularly the process of your own mind amp feelings madiba
302407877535084544,Politics,until the philosophy which holds one race superior amp another inferior is permanently discredited amp abandoned everywhere is war  bob marley
299980342843019264,Sports,rt piersnewbery gb fedcup column from laurarobson key words doubles nerves maracas physio confident rhythm brits beckham 
247726873457614850,Politics,with more spending and more debt barackobama is failing american families 
306706092765896705,Politics,cea fiscal responsibility means more responsibility in our spending towards key needs of ecoy and steer away from distortionary spending
306326753268355072,Politics,railway budget in select trains passengers can contact onboard staff through smsphoneemail for coach cleanliness amp real time feedback
306466301671534593,Politics,dmitry medvedev has chaired a meeting on the development of aircraft engine manufacturing  
304222660613779457,Sports,heres more from gary cahill after todays europaleague press conference  cfc
292596992788537344,Sports,out north is six and out christian gets his man who was eyeing off another pull for six out for   off  bbl bigfinals
304639414049570819,Politics,i am lucky i survived that day some of my classmates were not as lucky this needs to stop  wedemandavote
294412165903970304,Politics,vladimir putin has accepted letters of credence from  new ambassadors 
306064992468361218,Sports,bravo and sarwan make the difference 
303788069868425216,Politics,rt pmoindia pm conveys concern to uk prime minister about allegations of unethical means in securing augusta westland helicopter contract
296818857224593408,Sports,portdouglas sorry not sure why the signal ceased youll have to contact channel  on that one thanks for the feedback
300926614332653568,Politics,rt scotlandoffice uk govts first scotlandanalysis paper  legal implications of independence published  indyref
305907071629553664,Sports,from batting allrounder to test opener to nonbowling batsman to no  batsman to test opener again shane watson must be confused
299105801119883264,Politics,coming soon free microchip service for dogs in england its quick amp painless  chipmydog defragovuk dogstrust
306666466843967488,Politics,economic survey steps taken to secure the rights of people like rti mgnrega forest rights act amp the right to education
305943127078887424,Sports,st test  wicket p hughes is out c virender sehwag b ravindra jadeja  indvaus  bcci
306698628167241729,Sports,hill gone now for  mcdermott picks up the key wicket with pomersbach taking the catch bushrangers   ryobiodc
306107928384004096,Politics,suverenkar sorry to hear not sure how to help but a new airline coming this year 
301769169190416386,Politics,less than  of people feel they understand dementia join dementiafriends amp make a difference to your community 
303711979820965888,Sports,adamklukf the circuit closes at pm on monday march 
306697688336957440,Politics,despite all the past failures a useu trade agreement could actually happen this time 
301626772053704704,Politics,in his sotu address obama called for a diplomatic solution with iran how to get to yes 
292787087801978880,Sports,lynn comes of age in bbl  bigfinals
277090611805442050,Politics,dmitry medvedev the most important thing is for the leaders of political parties to act responsibly towards the people
271170374723575808,Politics,video in english press conference by chief cabinet secretary fujimura november  amn
305649455628173312,Sports,pakistan innings unravelling after lunch  now  savpak
304297732695277568,Sports,pm cetpm cst rt memphistennis sam querrey is taking over our twitter you can ask sam a question by using our hashtag memphistennis
305949975676846081,Politics,mohsinsayeed  ok will add you on fb though barely use it myself these days 
262299892100239360,Politics,four years ago candidate barackobama spoke to the scale of the times today he shrinks from it 
305988253562052609,Sports, overs bowled india to bowl their first over of seam ishant sharma runs in indvaus
26598044254347264,Sports,rt bradhaddinnot fakeshanewatson has scored more runs in one odi innings than notrickyponting could in four tests ausveng
24140888965,Sports,everton vs man utd will become first two teams to play  premier league fixtures everton are unbeaten at home since november man utd 
301187376540160000,Politics,video in english regular press conference by chief cabinet secretary suga february  am
29083942954995712,Sports,gee that wouldnt have even been a wide in indoor cricket pedantumpires ausveng odi
305902939699036160,Sports,st test over   runs i sharma  b kumar  ind  indvaus  bcci
302560292964020224,Politics,deputy secretary blank travels to bmw in spartanburg sc to highlight revitalization of american manufacturing 
291483995047337984,Sports,six white into the maximum action now hes on  off  balls   bbl bigfinals
299714170801254400,Politics,the stakes of the brennan nomination micahzenko amp sarahatcivic discuss us drone strikes w gideon rose 
300807098642599937,Sports,damienmarquez your tickets to the f were dispatched last week so you should receive them in a week or so cantwaitforausgp
305589612804456448,Sports,indvaus  up for india  trail by 
291483637474541568,Sports, up for cameron white big performance in a big match   bbl bigfinals
291146318028627969,Politics,summary of emergency economic measures for the revitalization of the japanese economy cabinet decision on january n
304671837118398464,Politics,rt fabooks book of the day why water and other natural resources might drive cooperation not conflict in africa 
302241983617982464,Sports,rt sportsnation lebron james is on fire nbajamtweets
303748164094160898,Sports,jayawardenes dislocated finger could put him out of action for four to six weeks 
293235980394180608,Politics, nelsonmandela arrives in dar es salaam tanzania then tanganyika on his clandestine trip to get support for the armed struggle
305990168215711745,Sports,st test over   runs n lyon  m henriques  aus  indvaus  bcci
298827999824982016,Sports,rt henrywinter judging community club of the year amp unsung hero for fl awards huge inspiring work clubs do in the community wi 
300502712158666752,Sports,gbfedcup first up will be british no  laurarobson vs dia evtimova fb no  heatherwatson v tsvetana pironkova
306325805749923840,Politics,railway budget uazadi expressu to connect places associated with freedom movement
289029925132984322,Politics,meeting on the main tasks and events for environmental protection in   
306086786017402881,Sports,collegiate sport has an edge amp excitement all its own i believe ndtv amp star sports have a potential winner in the rohinton baria trophy
302392115621675009,Sports,some interesting views from members of our online fan panel thechangingroom whouve had their say on the season to dateu
253656474289577984,Politics,during tonights debate follow the team romneyresponse paulryanvp teamromney andreamsaul ericfehrn ggitcho
305180867326787584,Sports,indvaus drinks in the morning session australia  clarke  siddle  pete has done a lot of this 
298898974805467136,Sports,rt jptrophy goal coventrycity  crewealexfc crewe take the lead through brad inman jpt
305002532126740480,Sports,no boundaries for colvin 
294383677079699456,Politics,pm speaking out on tax avoidance amp evasion is not anticapitalism to keep low tax rates then youve got to keep taxes coming in wef
305661463425597440,Sports,giles eyes summer success 
295517597187858432,Sports,novaks triple treat  peat ausopenfinal ausopen djokovic
303787052581912579,Politics,rt pmoindia ubpm i thanked prime minister cameron for the ukus support for indiaus full membership of the nuclear suppliers group
304518123917303810,Sports,rt umarnagi look at this espncricinfo app for windows  and youull fall in love beautiful ufd 
295572306460291072,Sports,rt tennishallofame kudos amp thanks to australianopen social media team for great coverage to make all of us in different time zone 
304666004926119936,Sports,this is the view from the stamford bridge tv gantry in the east stand what do you think cfc 
306023642561658880,Sports,batsman naeem islam and leftarm spinner enamul haque have been ruled out of the bangladesh squad for the tour of sri lanka
294478893841268736,Politics,world hindi day celebrated at university of lisbon 
291521373489205249,Sports, off  missed run out huessy again bbl bigfinals
304846837158924288,Sports,the icc cricket world cup  started on this day  years ago was that the greatest cwc what is your favourite memory of the event
289633987113127936,Politics,west wing week  or the interests of our country  welcome to the west wing week your guide to everythi 
300233855913316352,Politics,meeting colaba residents at the program 
35036543940968448,Sports,enjoy the fta coverage of the ashes well be back for the world cup ireland v netherlands cannot wait
305113320652935169,Sports,alastair cook wins the toss and puts new zealand in england are unchanged nzveng
304938696468226049,Sports,rafael benitez is soon to speak to media ahead of this weekends game live stream here  cfc
306243319153958912,Politics,the offroading has started bcim 
299917895117467649,Sports,rt mohanstatsman highest fc batg ave min k runs bradman sachin tendulkar lehmann boycott hammond hu 
306774772719693825,Sports,video this week marks  years since the legendary sir alf ramsey took charge of his first game for england 
296963012630306817,Politics,satyabhashnam indiandiplomacy sorry not at present
304927331074596864,Politics,the usha mehra commission was constituted for  months on dec   for inquiring into the shocking rape incident in delhi on dec
305995149543108608,Sports,st test over   runs n lyon  m henriques  aus  indvaus  bcci
306474780314460161,Politics,obama we wonut grow the middle class simply by shifting the cost of health care or college onto families that are already struggling
304962062243753984,Sports,rt espnnfl parttime nfl player parttime fast food chain employee gt 
304271021228314625,Sports,joe root creates selection dilemma  cricket nzveng
299178108957888512,Politics,tunisian president moncef marzouki and ep condemn murder of opposition leader chokri belaxefd article 
300564152974458880,Politics,at a eye camp organized with dr kulin kothari for kin of mill workers amp residents of shivdiparel 
277088635558457344,Politics,medvedev we are targeting smoking not smokers antismoking restrictions should be civilised not humiliating smokingban
301030530399469569,Sports,this weeks worldtennisnews includes our report on zeballos pipping nadal in chile and the titles for cilic amp gasquet 
300920293826895872,Politics,hm cash relief to eligible kashmiri migrants staying in jammu amp delhi enhanced from rs to rs per head per month from 
306766003491205121,Sports,cardiff gabb beat willis   farquharson beat reinwein  
304691018169720832,Politics,naqshband ah well 
295945673851928576,Politics,rt ticketstroops patron samantha cameron presented soldiers with tickets for britawards  at wellington barracks today
306783529663074304,Sports,hidden cyclone to miss cheltenham festival and may be aimed at galway plate via honestfrank horseracing
303924317501132802,Politics,rt cnntech your additional rules of the internet 
305626572633829376,Sports,new faces in nz test squad 
274445018641608704,Sports,dhaanu you generally need technique to hit a ball i find hes experienced enough
301700239759384576,Politics,mallikarjun kharge appeals to central trade union leaders to call off their strike and not to inconvenience the public
304722309237858304,Sports,rb  we rested some players today and still had  shots i was pleased with the performance of the team cfc
299184058175475715,Politics,prime minister the quality of research in russia is a sensitive issue the fact that it is being discussed by the public is a good thing
298453988205031424,Sports,retweet to welcome back rafaelnadal this week at the vtropen atp tennis
306481199130505216,Sports,tonights scottish first division match between dumbarton and raith rovers has been postponed due to a frozen pitch 
305973615260737537,Sports,st test over   runs j pattinson  m henriques  aus  indvaus  bcci
304887139001331712,Sports,to donate to rallyagainstcancer go to  or text rall xa to  aegonchampionships
295479215464263681,Sports,rt australianopen todays ausopen attendance   a nd sunday record previous  in  tournament attendance  th 
286711773107732480,Politics,built in  visakhapatnam port is indias largest coaliron ore port amp has a km rail network within its facility 
305848676524380160,Politics,day  bcim car rally today is the last day of the rally in bangladesh in about an hour convoy will depart for indian border bcim
294676791291961344,Sports,lasith malinga has been voted by you the fan mvp for bbl 
306130685939298304,Politics,rt if you agree its time for republicans in congress to protect middleclass familiesunot tax loopholes for millionaires jobsnotcuts
306282573942906880,Sports,rt porschesydsth want to join porsche at the australian grand prix get your tickets now dont miss out  aus 
305197421217062912,Sports,play continues in chennai australia  indvaus
266036907169939456,Politics,attn stations sandraendocnn amp gkhcnn will have generic liveshots  amet give your viewers the view from both campaigns
293402106776416256,Politics,dmitry medvedev has visited adler thermal power plant where he attended the ceremonial launch to full capacity sochi 
266003523211243522,Politics,cnn projects republicans will retain control of the us house u potu
297505428936462336,Politics,working toward a tech sector that reflects america  yesterday i had the pleasure of speaking at the technology 
304367142898368512,Sports,nitrocircuslive warming up for their big synchro trick train jump how awesome is that 
306394344108208128,Sports,accordingtoaldo spot on alex
304943796142104576,Sports,armageddonukf drop us a link once its up 
306293507037986816,Sports,the test is over early so the australians are getting some practice warne has come out to chat to lyon indvaus 
304636853422792704,Politics,watch gen stanley mcchrystal discusses how he changed special operations 
26597185504157696,Sports,quite good victory there from sunshine watson et al dominated like big brother in the backyard ausveng
294072579369603073,Politics,dmitry medvedevs interview with bloombergtv wef davos 
306448783846289408,Sports,read the joint ecb amp surreycricket statement  
306716797116231680,Sports,its a thriller at the mcg we havent seen a ryobiodc final like this since well last year live blog 
296774060619227136,Sports,tottylynn woo thanks very much 
277090142072762368,Politics,medvedev parties should propose slogans and programmes that meet peoples needs im sure small parties will gain popularity
293143975458660353,Sports,weve just announced the  atp world tour calendar welcome aboard rio 
292364599032954880,Politics,inauguration facts and figuresnas the nations capitol gets ready for the th presidential inauguration somu 
304276001532297217,Politics,seckerry our challenge is to tame the worst impulses of globalization as we harness its ability to spread information and possibility
306700917124788225,Sports,game on at the mcg hussey gone for  hopes picking up his second vic   with rain threatening  ryobiodc
301754479139758080,Politics,rt un worldradioday  did you know you can listen to unradio in  languages listen online here 
295556859065143298,Sports,read all about it novaks triple treatthe final match report  ausopen djokovic murray
304820727897534465,Sports,r ashwin is getting drift turn and bounce on his home ground cowan and hughes out  indvaus
295292878383632384,Politics,there can be no contentment for any of us when there are children millions ofnchildren who do not receive an education nelsonmandela
306463693678448641,Sports,rt mdoss espn hot dog eating contest please mynflcombine
279295324231700480,Politics,dmitry medvedev the internet has created a new matrix of communication between government and society opengovtrussia 
292591500167090176,Sports,cutting starts the fifth over at  bbl bigfinals
306698831125438464,Politics,drrajan economy has slowed due to external and domestic factors
268804478432604160,Politics,pres obama no evidencethat classified information was disclosed that would have had a negative impact on our national security powe
288192101424975872,Politics,rajagra retinaindia thanks happy to learn more about how they can get involved
274452117807312896,Sports,rt phixis khawaja to captain prime ministers xi against sri lanka 
305652333084295169,Sports,hello from the etihad stadium in manchester team news is expected soon amp well have match updates here too kickoff is pm cfc
297420702024339456,Politics,vladimir putin met with veterans of the battle of stalingrad  and will visit volgograd formerly stalingrad tomorrow
305752091723456512,Sports,rt colinfleming champions thanks to rohanbopanna for a great week and thanks for all the support and messages 
259750395742666752,Politics,today is the last day to enter for a chance to win a guitar signed by kidrock and paulryanvp enter here 
305890648370860035,Sports,st test over   runs b kumar  ms dhoni  ind  indvaus  bcci
294002404263866368,Politics,i believe that britain should want to remain in the eu so the european union should want us to stay euspeech
297052044622180352,Politics,the posse foundation selects first cohort of veterans for college success program 
306811643050995714,Politics,discover europe discover eu capitals of culture on foursquare subscribe to our ep tip list 
306692218058575872,Sports,ryan harris picks up the huge wicket of aaron finch for  victoria now  in the th live blog  ryobiodc
284899494817046528,Politics,telephone conversation with president of serbia tomislav nikolic 
293223915734585344,Politics,video in english press conference by chief cabinet secretary sugajanuary  amn
306668384416845825,Sports,paris stgermain want waynerooney real madrid chasing evertons nfellainim plus more football gossip 
306778829429542913,Sports,redfleety quite loud but it all adds to the atmosphere of the ground not many like it in the world
36273368277716994,Sports,can we get a big happy birthday to the aussie half of followtheashes happy birthday lessoninpride also  yrs in oz today for me 
303872036550356993,Politics,feedthefuture is helping keepwhatureap tune in here to find out how 
303457274368782336,Politics,video pm david cameron holds question and answer session at unilever indian headquarters in mumbai  pmindia
282821497637195776,Politics,postal stamps for alleppey lighthouse  years on the left amp mahabalipuram lighthouse  years on the right 
301522052773466112,Politics,tonight i propose working with states to make highquality preschool available to every child in america sotu
303783744395943937,Politics,photo meps debate mff eu summit with euhvrbarrosoeu giannipittella  amp  ufeuroparlphoto
305943518545862656,Sports,st test over   run  wkt m clarke  d warner  aus  indvaus  bcci
48039113760317441,Sports,that six from watson just landed in pakistan canihavemyballback
306511770397331456,Sports,goal aberdeen  ross county gary glen   spl
304576724249743360,Politics,video  meps  important topics  mff amp family rights in eu europarltv with phlamberts amp alexandrathein 
302755315554844672,Politics,well soon be uploading the recce visit video of the bcim car rally the epic kms journey from kolkata to kunming china
293256934751084544,Politics,sport is a great force for unity amp reconciliation nelsonmandela
301998180734734336,Politics,alternative fuels debate are green cars the future of european transport article 
300586129206431747,Sports,jackiemurray congratulations on being our th follower heres a special message from the aegon gb fed cup team 
303533401900720129,Politics,barry posen makes the case for a less activist us foreign policy 
255676358590603264,Politics,my vision for a vibrant rural america puts forth agriculture policies that support farmers and ranchers read my plan 
299173523409219584,Politics,my quarterly newsletter is out please visit  for more information
304266887422951426,Politics,rt usembassybbdos seckerry our engagement with the rest of the world begins by making important choices together
295572664804847617,Sports,a special thanks to our sleepisfortheweak crew we couldnt have done it without you thanks everyone for following and see you next year
302272344989249536,Sports,blade runner pistorius story looks to be straight out of ripleys believe it or not
302014983435345920,Sports,as always use the whereschris hashtag with your answer  first right will get added to our hall of fame list 
303784962044329984,Sports,thanks for all your replies to the tuesdaytrivia question the answer is jimmy sinclair at the old wanderers ground in johannesburg
298827782438408192,Sports,rt officialoafc tonights game has been postponed  
305324243653111808,Politics,why us involvement in asias island disputes will mean more friction  not less 
305415693841608706,Politics,horsemeat video epenvironment committee wants better labelling amp tougher controls amp sanctions after fraud scandal 
292607807352602624,Sports,out thomas caught behind for   off the bowling of cutting  off  required bbl bigfinals
304840370741719041,Politics,iamamer bizarre
303429989175545856,Politics,latest from david cameron india trip with group of  business reps education specialists amp parliamentarians  pmindia
301518596016836608,Politics,michelle obama arrives item  sotu
303541250634698752,Politics,proposals of governmentrf for housing privatisation deadlines 
292580252092350465,Sports,rt heatbbl another  from danchristian heatingup
303822911125475328,Sports,john terry has been looking ahead at the rest of the campaign  cfc
