TweetId,Label,cleaned_text
306048919241101312,Politics,supreetsays yes i love my stints there  say my hello to all
291520568396759041,Sports, off the over  required captain faulkner to bowl the last over in close discussion with veteran warne final spot on the line bbl
305661201076072448,Politics,samihadyh thanks
23918273185,Sports,premierleague fixtures for saturday th september  everton vs manchester united arsenal vs bolton wanderers fulham vs wolves
303751140166754304,Sports,martinh both need to register separately
306256653689438208,Sports,st test over   run n lyon  m henriques  aus  indvaus  bcci
277091078610513921,Politics,how will fridays jobs report impact fiscal cliff talks karincaifacnn has details in a p et package book tags 
281775390631030784,Politics,russianchinese relations enjoy unprecedented trust and cooperation we must focus on high technologies
301971484367286272,Politics,lets dance meps join moving initiative to protest over violence against women article  onebillionrising
301839883771723776,Sports,beckymooreo  days and counting cantwaitforausgp
305980869879951360,Sports, wicket m starc is out c sachin tendulkar b ravichandran ashwin  indvaus  bcci
297683707123335168,Politics,weekly address a balanced approach to growing the economy in  
305316483083411456,Politics,photo poems of rabindranath tagore to welcome and celebrate the bcim relations and the car rally did you 
282798041575075840,Politics,navigating my way down from the lantern room 
302045017025953792,Politics,rt proflind why test nuclear weapons to see if they work see my foreignaffairs article with keir lieber and daryl press  
305252210525229057,Sports,rt stuartbroad the bowlers with the best bowling coach in the world according to him 
306465221436915713,Sports,paris stgermain manager carlo ancelotti says david beckham will start for psg in the french cup last  tie against marseille bbcfootball
22854826299760640,Sports,youre not going to believe this but watson has been involved in another run out some one get that man a stopgo sign ashes
304454244499607552,Sports,to be guaranteed nd on the test championship table at the  april cutoff date australia needs to defeat india  or better
306027753147346945,Sports,tjfblood why do you think england will
301517221568577536,Politics,obama ucamerica moves forward only when we do so together and that the responsibility of improving this union remains the task of us allud
293481544650211328,Politics,planned order of the inaugural parade  the presidential escort the presidential escort is a military and 
295530912303702016,Sports,djokovic what else can you do but be happy amp bring that joy to other people ausopen peat
306406228110741504,Sports,collingwood goes under the knife 
304057470182121472,Sports,lewishamilton tells mensjournal why hes captain america  f
292323172462759938,Politics,follow first lady michelle obama flotus on twitter  yesterday on first lady michelle obamas birthday the wh 
300231657737289728,Sports,gbfedcup gsm hungary in dead doubles    over konta and robson aegon gb fed cup team beat hungary overall  rubbers to 
304612766709329920,Sports,mcc reveal squad for argentina trip 
300552282628558848,Sports,gbfedcup watson breaks again to lead  serving for the tie
305056512101978113,Sports,rt loganakadoggs favoritesportsposter as a kid was easily the packers little kid poster just a classic 
301945391132327936,Politics,i would hope that the average individual experiences  of the highest levels of emotional attachments satisfactionamphappiness when in love
300522586830422016,Politics, february  fw de klerk announces at a press conference that nelsonmandela would be released from prison the next day justice
305163130328207360,Sports,brendon mccullum is not giving up the fight and follows two pulled fours with a straight six off finn nzveng
304080480507158529,Sports,mclaren has a new young driver  f
305785961323847680,Sports,next time youre feeling unmotivated remind yourself of this man gt 
306451732819496960,Sports,michu from the swansparade itus really good weure enjoying it it was a great performance and we deserved it we are the championsud
306621939571630080,Sports,peter handscomb takes a blinder to dismiss greg moller for  clint mckay picks up his second wicket qld   ryobiodc
283076975197827072,Politics,noted some very innovative suggestions thank you i will speak to those who are directly in charge
301570212812177408,Sports,help pick this years nitrocircuslive stunt for chance to win a trip to  fxae rolex ausgrandprix 
296772371518480384,Sports,mstana protocol tradition
306044951186243584,Politics,rt wfp look at this and then remember hunger is the worlds greatest solvable problem 
267868044909477889,Politics,on nov  pm noda visited fukuoka prefecture he enjoyed the hakata kawabata shopping district in fukuoka city n
296208332346257408,Politics,negotiating a bilateral shipping treaty with my panamanian counterpart secy amp dg ministry of shipping govt of india 
260162242211893248,Politics,rt paulryanvp our thoughts amp prayers go out to the victims amp everyone affected by the senseless act of violence in brookfield 
276755799441809409,Politics,condolences to president of the philippines benigno aquino in connection with the typhoon in the southern philippines 
306443323244158976,Politics,domestic workers also protected by the sexual harassment of women at workplace prevention prohibition and redressal act 
296819453801422848,Sports,mangelesaguirre another year gone we love all the fans were getting from south america hello chile 
292457958925803521,Politics,weekly wrap up ucnow is the timeud  watch the west wing week here heres a quick glimpse at what happened this  
305678739914756096,Sports,yellow card for rodwell cfc
296663528159457280,Politics,latest on prime ministers trip to algeria  pminafrica
304433917019189248,Sports,rt starsportsindia cricketwallah hi ayaz indausepic quiz at am ist today on twitter star sports tshirts to be won please remin 
29081655985577984,Sports,so after almost playing on twice sunshine goes to the well again brainless batting
304982564815396865,Politics,seckerry we value health and nutrition and the principle of helping people gain the strength to help themselves feedthefuture
306529895272566784,Sports,evertons assistant steve round says marouane fellaini should be back for saturday after missing this evenings game through injury efc
304071522589503488,Politics,rt wwaystation masai passed away a few years ago but he lives in our hearts and memories look at those claws 
305682778442326016,Politics,photo district officials come in to welcome the convoy en route sylhet 
32642653065576448,Sports,testmatchsofa roving reporter at the ground if you need anything
260551197130383360,Politics,barackobamaus foreign policy is unraveling in the middle east amp our national security is threatened throughout the world cantaffordmore
290032264799219712,Politics,job fair organized for mumbais youth already thousands of candidates amp many jobs offered ends tomorrow evening 
301520659589251072,Politics,fact president obama is doubling fuel efficiency standards which will save consumers more than  at the pump madeinamerica
300598870419861505,Politics,europe at the crossroads where should we head now watch europarltv interview with two meps 
303947571800453120,Sports,which two teams do you think will finish top of the world cricket league championship and qualify for the cwc
305380139309604864,Politics,these cuts donut have to happen congress can turn them off anytime with just a little compromise  jobsnow
301302886535688192,Politics,medvedev we will raise wages for more categories of teachers including teaching assistants counsellors and special needs experts
293214632619954177,Sports,jeremy chardy defeats seppi     to reach his first major quarterfinal at the australianopen atp tennis ausopen
298333561759617025,Politics,good can be achieved amongst human beings who are prepared to trust prepared to believe in the goodness of people nelsonmandela
254684720405815296,Politics,women have had enough of barackobamaus disappointment we need new leadership to get our economy growing again 
306699518492168192,Politics,cea cad widened to  of gdp in 
305965920839430144,Sports,szwakala crash it p
295568674868318208,Sports,victory is sweet djokernole hands out chocolate at his presser more in our final ausopen diary  atp tennis
281773030785568768,Politics,putin the final decision on daylight saving time will be made following a study currently being conducted by the government
302543040063610883,Sports,the down time between your teamus last game and their next is the worst
301901492024115200,Sports,rt winningformula ausgrandprix you definitely got my heart racing look what i got in the mail todayawesome 
304936900714713088,Politics,rt pmoindia photo prime minister reaches jaisalmer airbase in rajasthan on his way to witness iron fist  exercise  
304274268034834432,Sports,the teams are out in barcelona for the nextgenseries game live on chelseatv remember cfc
294787931791585280,Sports, andymurray will play djokernole in the australianopen final after beating federer       atp
283160514991902720,Politics,the presidents visit to india meeting with prime minister of india dr manmohan singh 
291572387877629952,Sports,rt scorchersbbl big final ticket info heres everything you need to know for buying tickets for saturdays bbl decider vs heatbbl 
297505428890333184,Politics,weekly wrap up strengthening our countrys future  watch the west wing week here heres a quick glimpse at wh 
306506959073472512,Sports,whatever level of football you watch tell us who your playeroftheyear is well retweet the best ones bbclive bbcfootball
300528129078870016,Sports,gbfedcup cont laurarobson im going to stretch now then support heather and hopefully she can do it
305364331929931776,Politics,rabhsinha ha ha thanks 
303887746810912768,Politics,meeting on the socioeconomic development forecast until  and the main parameters of the russian budget system 
305940406074482688,Sports,cartoon lyon is jealous of watson indvaus 
304974037417857026,Sports,jonathan ouegnin used nothin but hops to boomshakalaka the guy in front of him gt  via unite
305881961128402944,Politics,before blockbuster films there were blockbuster books but the original les mis wasnt so down on revolution 
304274934597828608,Sports,were underway in barcelona cfc
300282995217149952,Sports, gasquet will face benoitpaire in opensudfrance final after beating nieminen     atp tennis
304559883519418368,Sports,what are your predictions for the first test between india and australia testcricket
301420944986103808,Politics,help make life better for people with dementia  join the dementiafriends today  please retweet
283055205547925505,Politics, be brought in within a defined timeframe to ensure quicker trials amp enhanced punishments to criminals of sexual assaults against women
265991017096966144,Politics,cuyahoga county board of elections director speaking to media live now on ns ch 
306694431980011522,Sports,bell happy with queenstown pitch 
305703295039729666,Sports,tsonga comes back from match point down to top berdych    for his th atp title at the open in marseille tennis
305737530505043969,Sports,congratulations also to bradford city  everyone connected with the club should be very proud of what theyve achieved capitalonecup
306730322475769856,Politics,india putsxasmartphone in space  hindustan times 
291703023644860416,Sports,shaunmarsh saved his best innings of bbl when it mattered most  bigfinals
302066135719874560,Politics,too often violence against women amp girls goes unpunished we want this to change amp were taking action  billionrising
303842248255238144,Politics,calm election but no real debate amp competition in armenia elections says observer cabrnoch in yerevan armvote 
292559287094484993,Sports,first four of the bigfinal goes to forrest cut well through point bbl
304579045788631041,Sports,wheresjackie answer  she was at crawley town well done if you were one of those who got it samjohnson was st amp joins our list
24746008333,Sports,that blog is one that gets updated very regularly and its not just about the premiership its about all different issues in the game
306464956742770690,Sports,rt danroan fa pledges to tackle the bane of grassroots football poor facilities but is more xa needed some thoughts here  
294844193162018816,Politics,dmitry medvedev meets with head of the republic of buryatia vyacheslav nagovitsyn 
258250694874759168,Politics,barackobama has amassed more debt than any other president a nd term would threaten to drive the debt to a record t cantaffordmore
306330040310849538,Politics,vabtak wah wah
283836812760326145,Politics,prime minister abe became the th prime minister the rd person to assume the post since the first pm of japan 
306665856723726336,Politics,economic survey the services sector has shown more resilience to worsening external conditions than agriculture and industry
301546827138867200,Sports,rt camsmotorsport cams followers want to know more about amsf and ausgrandprix supporting young talent take a lookn  
300530175236517888,Sports,gbfedcup watson to serve
284043473622016001,Politics,nelsonmandela has been discharged from hospital this evening 
304234984489771008,Politics,how do we empower people with disabilities disabilityrights statedrl 
306469445067489280,Politics,watch live president obama speaks in virginia about why congress should prevent severe spending cuts  jobsovercuts
303149364027748353,Sports,deandra dottin gets off the mark with a huge six over deep midwicket from only the second ball she has faced in the game wwc
305918329489612800,Politics,isabellawhy ha ha thanks 
306752279447486465,Sports,well done to everybody who guessed eden gardens in kolkata as the answer to our whereami trivia question
266084029856620544,Politics,the evening winds down and the crowds clear out in chicago 
301726832900833280,Sports,rjmeenakshi of course i do still with my fm
268358845129175041,Politics,meeting with the president of the republic of the congo cooperation in the economyenergyinfrastructure and transport 
305275936465641472,Sports,video in case you missed it british tennis players do the harlem shake  harlemshake rt amp share
304621853631184898,Sports,kirannc homeofcricket a free hit is only given for a front foot noball
305216494231511040,Sports,wicket sehwag out more inswing from pattinson this time bounced onto the wickets just clipping leg stump india  srt in indvaus
304509747871227905,Politics,video in english press conference by chief cabinet secretary suga february  pmn 
290357688586612736,Politics,dmitry medvedev congratulates russian mass media on their professional holiday  
304533791840538624,Politics,haroldholzer when lincoln first ran for president in  he proposed to contain slavery not outlaw it
291512942837518336,Sports,six march is exploding here long over long on great striking   off the over bbl bigfinals
302088155417432065,Politics,valentine thanks for your images on most romantic places in europe we published a selection on facebook  loveeurope
23917580139,Sports,fulhamfc midfielder jonathan greening is eager to fight for a place in the starting eleven
304913235499421696,Politics,video review euus trade tafta cybercrime humanrights  top issues from ep this week 
304525311259836416,Sports,did you know asian test teams have played seven tests at centurion and lost the lot to officialcsa testcricket
296819869159153664,Sports,holdtolove thanks great to hear aosos was especially helpful 
304788175816114177,Sports,this is probably the coolest halfcourt shot ever gt  via hunterphillips
300552070086414336,Sports,jaffer loses out on openers slot but dhawan is very good choice too especially since lefthanded gambhir has not been selected
291056792467828737,Politics,on january  prime minister shinzo abe visited osaka and hyogo prefecturesn
305671994362449920,Sports,we also have a live matchday blog up and running on the capitalonecup website    make sure you join in the build up
283055468828577792,Politics, these are being recommended by a panel of jurists led by justice verma former cji any other specific suggestions
306182941313204225,Sports,a family pass to the ausgp starts at  for  adults amp  children or  adult amp  children sennews embracetherace
306345279857254400,Politics,karunajohn yes its the first time we learnt those words
266062630580535296,Politics,mitt romney tells supporters he called president obama to congratulate him pomo
301157075030011905,Sports,rt mazdaaus our great ausgrandprix competition closes this wednesday for details click  or mobile devices http 
302213316921675776,Sports,rt theschibecsta on the grid returns sunday on  sen from  to  will have a full wrap from sydney test day and jackperkins in n 
304537767927504896,Politics,did you know in lincolnus time there was no security at the white house citizens could simply walk in haroldholzer
305834017033441280,Sports,ausavengl calferguson has departed for  and aus a are  in the th over rolandjones the wickettaker 
305948459851190272,Sports,st test  r jadeja to m clarke  runs  indvaus  bcci
291544590408896512,Sports,shane warne has been reported for breaching the cricket australia code of behaviour  bbl bigfinals
303898981908492288,Sports,its settled then shane watson to bat at no  
304466257514733570,Politics,ronthedon thanks just confronting the fools
294481249874096130,Politics,see the latest on inida thailand relations 
305580732527550464,Sports,john mikel obi considers todays game against manchester city  cfc
306340923892178944,Politics,bhuto ha ha now that is pushing it
305660280141139968,Sports,chelseatv have live commentary from todays game which you can listen to right here 
303512103862542336,Politics,young persons emergency accommodation scheme nightstop north east win prime ministers bigsociety award 
301256674306576386,Politics,rt foreignoffice foreign secretary williamjhague condemns reports of north korean nuclear test 
259063032016146433,Politics,barackobamaus latest stimulus will cost  billion amp bears a strong resemblance to the  stimulus bill 
291012922505842689,Politics,on jan  pm abe received a courtesy call from fukushima prefecture governor yuhei sato 
305921056575721472,Sports,watson made   india continuing to focus on spin australia trail by  runs scorecard  indvaus
305986799807905792,Sports,lastwicket pair manages to avoid innings defeat that and moises henriques batting are australias only positives from this test
305213737370005504,Sports,helenbarker see you soon 
305330776105439234,Sports,kyle abbott has  for  on debut and hes south africas sixthchoice test fast bowler  savpak
304700522693275648,Sports,oscar with a lovely ball to ramires who shoots and hits the post cfc
298892253307490305,Politics,announcing the state of the union white house social  on tuesday february th president obama will deliver h 
306254148981108736,Sports,st test over   runs n lyon  m henriques  aus  indvaus  bcci
295530692073373697,Sports,rt sharkotennis all four no  seeds in singles doubles men women win australianopen titles st grand slam tourn since  wimbl 
304712403512328193,Sports,fulltime chelsea    sparta prague agg  cfc
292130396177563649,Sports,dragonpunk still valid
304860668782338048,Sports,happy birthday roscohutchins from the entire atp family tweet your messagesphotosvideos to ross using happybdayrosco tennis doubles
295930152049844224,Politics,rt ministerdisppl find out about accesstowork on govuk 
293744887327768576,Politics,video in englishpress conference by chief cabinet secretary suga january   pm
23948372334,Sports,gerardhoullier formally of liverpool has been confirmed as new manager as astonvilla
304694943191007232,Sports, mins added time cfc
299057701877604352,Politics,before eu summit on thursd meps voice euco demands watch from am cet for statements by eucouncil amp eucommission 
129324239449894912,Sports,ohmygerrard good luck on your county trials  where are they im actually from stroud in gloucestershire 
301033527032569856,Politics,vladimir putin expresses condolences to family and friends of former gazprom head rem vyakhirev
296953596535263232,Politics,its the th anniversary of floods see photos  amp discover how envagency responds now 
303896119174365184,Politics,president obama if congress allows this meat cleaver approach to take place it will jeopardize our military readiness
306322271922970625,Politics,railway budget  additional services to be introduced in mumbai and  in kolkata
303160810740518913,Sports,deandra dottin gone b lawry would have shouted this could be the world cup this could be the world cup  wwc
305632787069804545,Sports,st test over   runs ms dhoni  b kumar  ind  indvaus  bcci
304154395313061889,Politics,pm signs book at jallianwala bagh memorial deeply shameful event uk must stand up for peaceful protest pmindia 
305895002100334592,Sports,st test  n lyon to b kumar b  runs  indvaus  bcci
294804458024615938,Politics,rt dfiduk my world is the united nations global survey for a better world this is your chance to be heard  spread the word http 
304278075313635331,Politics,proponents of us retrenchment exaggerate the budgetary savings of a smaller global profile 
259373300273266688,Politics,ff romneyresponse teamromney romneyroadteam romneybus
301085687057375232,Sports,lukeydonald the drivers will be doing a signing session on thursday for more info  cantwaitforausgp
301351910441635840,Sports,rt ajaymaken yes mtjatinkapadia ajaymaken i am not sure why ioc wants to cancel wrestling even though it is played in  countries
269108637866283008,Politics,telephone conversation with prime minister of israel benjamin netanyahu 
306343485953429505,Politics,amithbn what are you talking about
24469836237,Sports,stewart downing of aston villa put them  up with a diving header just before the break but then kenwyn jones cancelled it out with a
302837247730913283,Politics,the sequester and the future of us defense spending 
292124509874565121,Sports,rt dragonpunk awkward moment when the temperature in sydney is higher than australias score ausvsl
303833036078858240,Sports,david warner faced the fast stuff today as he continues to recover from a thumb injury 
306786449192267776,Sports,fl football league games have been played on  different grounds
289238237430562816,Politics,on jan  pm abe attended new year party jointly hosted by  economic associations opening address is availablen
303173264556040194,Sports,rt capitalonecup in exactly  days time officialbantams amp swansofficial will have just kicked off at wembleystadium in the c 
302847006676774912,Sports,the ausvwi game at cci in mumbai begins at pm ist on sunday  remember that it is free entry to the final of the wwc
300829590996267008,Sports, rafaelnadal says that he now has a much better idea about where his game and body are  welcomebackrafa atp
284697667353866241,Politics,year in review white house office hours  during the myk twitter qampa with president obama official white hou 
303788206573363201,Politics,rt pmoindia pm ubpm cameron and i reviewed the entire expanse of our bilateral relations and expressed satisfaction with progress in o 
305603973866483712,Sports,dhoni is very quick between the wickets ashwin has other skills  bhogleharsha on air indvaus
303399767281639425,Sports,rt glennmcgrath congratulations to the southernstars on winning their th odi world cup sensational effort girls enjoy the cele 
23182402444591104,Sports,thank you to all who followed the ashes through the series well post an ashes review in trademark irreverent style tonight well done eng
284611576059789312,Politics,basic policy  december   
304451912114270210,Sports,rt memphistennis in the biggest upset of the day american jack sock took out the no  seed milos raonic tonight    sock now p 
43069666473689088,Sports,got lucky against netherlands could have very well been looking at one point from three games
305189662039883776,Politics,photo received a warm welcome at faridpur bangladesh with people handing out flowers and refreshments to 
298476076613632003,Sports,rt officialcufc now heres an unusual request   
304903295485493248,Sports,richietamartin no refund  it will state the exact details in the ts amp cs on the back of the ticket you purchase
304746684162908160,Politics,obama plans to appoint mits ernest moniz as energy secretary his case for nuclear power 
285159006320865281,Politics,  nelsonmandela issues his first new year message as president of south africa 
296974541631143936,Politics,medvedev we have only one goal u to improve the quality of life for russians this is the criteria our work will be judged by
299161022789455873,Politics, in  dot adopted international norms in  we strengthened them we need support of state amp local govts for better enforcement
305943294595170305,Sports,ashwin traps cowan in front jadeja literally bounces out hughes india taking complete control in chennai indvaus
305141882793639936,Politics,photo school students welcome bcim car rally convoy en route dhaka 
301120335581954048,Politics,rt google join our firesidehangout w president obama thurs   pm et 
293443226034114560,Politics,rt cnnnewsource check it out vice president biden is giving remarks at the postinauguration luncheon live on ch  hd info on the n 
306478395510890498,Politics,seckerry useu transatlantic trade and investment pa rtnership is historic agreement to grow prosperity on both sides of atlantic ttip
298894135664996354,Sports,connorarmstrong that was the previous best conor  
268225464617807873,Politics,on nov th pm noda observed kokokara matsuri a childrearing support event held by shinjuku wardn
305920396283215872,Sports,st test  wicket s watson is out c virender sehwag b ravichandran ashwin  indvaus  bcci
