TweetId,Label,cleaned_text
304271250237304833,Politics,seckerry the value of the statedept and usaid is measured not in dollars but in terms of our deepest american values
304834304222064640,Politics,rraina i fear so
303568995880144898,Sports,watch video highlights of the wwc final between australia and west indies at 
304366580664528896,Sports,rt chelscanlan at nitro circus at albertpark  theymakeitlooksoeasy ausgrandprix chadwickmodels cantwaitforausgp
296770931098009601,Sports,cricketfox always a good thing thanks for the feedback 
306713195832307712,Politics,dr rajan fiscal consolidation will create more space for monetary policies to act
306100962337112064,Politics,fact more than  defense employees will be forced to take unpaid leave if congress doesnt stop impending spending cuts jobsnotcuts
305951758759366657,Sports,st test over   runs  wkt m wade  m clarke  aus  indvaus  bcci
304482567158104065,Sports,some of africas top teams will try and take a step closer to the wt this week check out qualifying fixtures 
303806584964935680,Sports,can you beat the tweet of rorygribbell and zebras stopped play for the most unusual reason for a club cricket match being halted
306682472169623552,Sports,queensland finished their innings well thanks to a great knock from jason floros  qld   ryobiodc
306094964914401280,Politics,khannisara thanks wont respond to their rubbish
294606381783322625,Politics,president obama nominates mary jo white to run the sec  president obama announced today that he wants mary jo w 
284243333201686528,Politics, opening statement by pm abe at the press conference on december  n 
254347919229063168,Politics,barackobama has campaigned for years on his commitment to the military but his record doesnut match the rhetoric 
303458616621535235,Sports,rt aegonclassic gb fed cup team give their support for help harry help others harrymoseley  wearing their special hhho bracelet htt 
304642350859304960,Sports,themanojprasad yes i am
306322535920857088,Politics,railway budget for the first time  ongoing projects identified as priority projects with the committed funding
305087150821625856,Sports,buy your ausgp general admission tickets before march  for early bird prices f cantwaitforausgp 
300155542826008577,Sports,gbfedcup robson back on court following treatment for a left shoulder injury
305615385623945216,Sports,one for dhonius critics he has more runs in fewer tests as india captain than ganguly ht raghavitis  indvaus
304270365704744960,Sports,sadly sharmila tagore could not come as she was ailing
266017766702723072,Politics,indiana senate race  richard mourdock speaking now live newsource ch 
303453980573437952,Sports,watson and cowan shine but australia will be concerned with their showing against india a 
266080403209740288,Politics,president obama says hell work with mitt romney in the coming weeks to get things done in dc potu
305957332192468992,Sports,out wade is bowled harbhajan from around the wicket has wade sweeping missing and losing his stumps out for  australia  indvaus
306270595836956672,Sports,st test  n lyon to s tendulkar  runs  indvaus  bcci
291518381717344256,Sports,sorry wright this is nailbiting
278568880476143617,Politics,david plouffe your story bouncing around the white house  senior advisor to the president david plouffe just s 
303799049318957057,Sports,good morning everyone its a lovely day down in cobham as the squad returns to training after a day off cfc
295816549883858944,Politics,indians celebrate republic day all over the worldn
305672149245497345,Sports,first corner of the game goes to man city and it is cleared  mins played cfc
306832539874623488,Sports,exaston villa amp whafc forward john carew will not be signing for inter milan due to his current athletic condition bbcfootball
304267284246065152,Politics,seckerry no investment a nation can make returns a benefit as sizable as an investment in foreign policy
305695872103112705,Sports,dynamic dhoni takes australia apart 
304157630681735168,Politics,video in english press conference by chief cabinet secretary suga february  pmn
304683937534455810,Sports,oscar with a challenge and sparta win the first freekick of the game cfc
300699571611369472,Sports,rt piersnewbery gbs annekeothavong talks watson amp robson injury problems her fedcup debut in  and what a home tie would 
304472546093449216,Sports,mclarens looking fast this season with perez quickest on day  of testing in barcelona 
298457528747061248,Politics,photos pm hosts summit at chequers attended by president karzai of afghanistan and president zardari of pakistan 
271594100619350016,Politics,vladimir putin has chaired a meeting of the agency for strategic initiatives supervisory board 
266045769855926274,Politics,paul ryan wins reelection as wisconsin representative u po
298738290717245440,Politics,video in english press conference by chief cabinet secretary sugafebruary  pmn
305304475906752513,Sports,young guns pujara and kohli also very impressive more so the latter for the manner in which he messed up ozs field placing to restrict him
269751597230329856,Politics,joint news conference with vladimir putin and angela merkel  
291510654538502144,Sports, after four dl target after five overs is  bbl bigfinals
302322382390059008,Politics,rt govindethiraj govt building internet infra to encourage content creation not to regulate it milinddeora tells me in excl intvw h 
297229537987657728,Politics,rt pmoindia pm releases the commemorative coins for silver jubilee of mata vaishno devi shrine board with jampk governor and cm htt 
277091499831853056,Politics,dmitry medvedev on kashincase evidence is still being collected but the case is not closed and will be fully investigated kshn
306322955879714816,Sports,tara moore on her win in surprise ive had a really good week amp it was a great tournament i had loads of fun hopefully more to come
299135257817522177,Sports,rt bfc club statement  
306463731074859008,Sports,rt liverugby if found guilty points deduction the likely punishment lwelsh second bottom of pship  points ahead of sale with  
268885075209383936,Politics,an overview of the japanphilippines summit meeting on november th 
306496142206722049,Sports,kevin mirallass goal for everton is efcs th facup goal during the current campaign and all have been scored by different players
306719563507175424,Sports, overs left  runs to win and  wickets in hand for the bushrangers mckay  and sheridan  with mcdermott to bowl ryobiodc
291433771549470720,Sports,brad hodge greg shipperd and shane warne check out the wicket before tonights big semi final bigfinals bbl 
306730672402362368,Politics,tata among top  global brands  business standard 
298854314523389952,Sports,mrmlees hi matt  unfortunately the app for mobile surveys is not compatible with that phone yet
306002742839750656,Sports,are you a level  tennis coach places are available on the level  coaching course in lancashire starting  april u 
278703567974576128,Politics,the pms instruction after north koreas launch of missile which it calls a satellite after the security counciln
296980992495869952,Politics,photo david cameron meets a young libyan activist in martyrs square tripoli  pminafrica
296825189348544512,Sports,rt craigtiley a different week australianopen site looking different as we take everything down we miss it  
299923604336943104,Sports,mohanstatsman tks
282797601772945408,Politics,alleppey lighthouse 
303477029179908096,Politics,ep this week budget economy horse meat number of meps carbon credits article 
279312178039881729,Politics,madiba is being cared for at a pretoria hospital issued by the presidencyza 
303893452209389569,Sports,possible fa cup quarterfinal date set  cfc
305479693312880640,Sports,bupass langer rapt with warriors fightback at the waca read why 
304078187711836162,Politics,you can follow live updates photos and blogs straight from the bcim car rally on our tumblr blog 
305407173247266816,Sports,wake forest just dropped  miami this years ncaa tournament bracket is going to be the hardest multiple choice test ever
301552723923443713,Politics,photoset social state of the union stats according to google the top four rising search terms during this 
294304304070811648,Politics,video in english press conference by chief cabinet secretary suga january  am
298864592199753730,Sports,also on this week are two npowerchamp managers  theposhdotcomus darren ferguson amp bfcofficialus david flitcroft podcast
261953376303071232,Politics,i know it because i have seen it good democrats can come together with good republicans to solve big problems what we need is leadership
299814831714885632,Politics,israels former chief negotiator with damascus on why the israeli air force struck syria and whats next 
304448136741548032,Politics,video in english press conference by chief cabinet secretary suga february  am
302704108584972288,Sports,daily tickets for the aegon international are on sale now get yours at  or by calling   
303741385025150976,Sports,rt starsportsindia cricketwallah hi ayaz were active on twitter now have some exciting quizzes and activities lined up pls let ur 
304286462357155841,Sports,halftime in the nextgenseries  fcbarcelona  chelseafc cfc
280545396147748864,Politics,a message from former president nelsonmandela on announcing  the international year of older persons 
306075937320099840,Politics,lifeofpi was undoubtedly the best movie of the year cant wait to watch djangounchained though
300214177585324033,Politics,inaugurated a selfdefense workshop for female students organized by colaba congress amp mickeymehta 
305287398558949376,Sports,goal  fulham a wellworked goal from the hosts after an enterprising run from roberts is finished off by williams cfcu
304878116701077504,Politics,video in english press conference by chief cabinet secretary suga february  pm 
299606852755410945,Politics,things we learnt in the february plenary overview of all the highlights 
304885960183799809,Sports,if you missed it watch roscohutchins on bbcbreakfast talking about aegonchampionships rallyagainstcancer  
251059284031442944,Politics,barackobamaus policies toward china are hurting small businesses we canut afford another  years like the last 
303531551881302016,Sports,thought mumbais peak hour traffic was bad but delhis is the pits have been on the road for  hrs from okhla to janakpuri
304670942976675840,Politics,rt tsonenshine congrats appsafrica winners slicebiz proworkapp ffenebiz challenge developing solutions for youth unemployment h 
302145145611104256,Sports,sorry thats asad shafiq not malik
306406987292348416,Sports,rt charrisespn in this years nfl combine review youll find youtube links giving highlights for most players i discuss  
306359424744845312,Politics,watch epenvironment workshop on diagnostic medical devices and the ethics of dna testing starts at pm cet 
304323615803973633,Politics,join empowering lgbt youth amp combating homophobia in sports qampa with angelahucles feb at estutc  conx
302015693191254017,Politics,valentine if you fell in love abroad youreurope offers info on marriage amp registered partnerships in eu  eyc
305967108087504896,Sports,fiddyracer what team are you racing for 
305671720700870656,Politics,between terror errors in multiple cases amp political bickering are we apathetic in our response to terrorism we the people at 
306284550433165313,Politics,our freedomampour rights will only gain their full meaning as we succeed together in overcoming the divisionsampinequalities of our past nm
306711000986554368,Politics,dr rajan on dbt the process of roll out of the pilots is important to learn from them
270504854936489984,Politics,telephone conversation with president of ukraine viktor yanukovych 
305715604843794433,Politics,scvaid thanks v much
295527458399219714,Sports,murray no ones ever won a slam the immediate one after winning their first one not easiest thing to do i got extremely close
294379990496202752,Politics,pm approach not about turning our backs on europe  is about making eu competitive open amp flexible amp securing ukus place within it wef
305912115804381185,Sports,st test  h singh to e cowan  runs  indvaus  bcci
300918261007126528,Politics,hm president of india assented to unlawful activities prevention amendt act  on 
304932041575784449,Politics,photo u an weuve reached the bangladesh border bcim 
303170821017464832,Sports,onehanded stunner by stahelkar to seal world cup no  for australia only  have been played  wwc
306229497206804480,Politics,were off to imphal bcim 
304587281489068032,Politics,rt statecso icymi our very own amb barton was on cspan yesterday where he discussed all of our major engagements  
286715991830978560,Politics,vpts dusty cargo handling processes are getting increasingly mechanized to eliminate air pollution 
305304176034983936,Sports,sachin was superb today feet moving well choice of strokes immaculate some of them delectably executed what did you guys think
301520821153828864,Politics,rt whitehouse obama ium also issuing a new goal for america letus cut in half the energy wasted by our homes amp businesses over 
304538324436144128,Politics,learn what led pres lincoln to sign the emancipation proclamation amp end slavery in america  conx haroldholzer
248893806408249345,Politics,candidate obamas slogan in  was uyes we canu his slogan now is uno i canutu its time for a new president
264505656202100736,Politics,ff romneyroadteam rickgorka sarahhaleytn dgjackson amhenneberg alcivar
306325985228361731,Politics,railway budget  companies of women rpf personnel set upanother  to be set up to strengthen security especially women passengers
292990239415336960,Politics,joe biden takes the oath of office for the vice presidency of the us the walk up oath his brief comments posu posu posu
278855960913649666,Politics,the president natural population growth has been recorded in the past five months for the first time in russias modern history
299516707700097024,Politics,pm on eu budget in nov the numbers were much too high they need to come down and if they dont there wont be a deal euco
288204098195570688,Politics,dmitry medvedev and his wife attended the christmas service at christ the saviour cathedral in moscow 
301303834238652416,Politics,prime minister the heads of all regions will bear personal responsibility for raising teachers salaries
294439941713297408,Politics,dmitry medvedev has attended a working breakfast with foreign investors in davos wef 
305712658693378050,Sports,the kings of stats in discussion  rajeshstats and zaltzcricket look at nelson in new light have a look 
295097803351400448,Politics,rt ddnewslive nation celebrates th republic day 
294491586572742656,Sports,hilarious watch djokernole make a court call to treat an ailing leconte at australianopen  atp
306345853000499200,Politics,mandeepbajwa  nitingokhale mdiirfankhan
305579828973821952,Sports,wicket clarke brings lyon on with immediate result capturing the centurion kohli at mid on out for   indvaus
304380097782235136,Politics,may i have this dance 
305898900726894592,Sports,st test over   runs i sharma  b kumar  ind  indvaus  bcci
304637533202038784,Sports,bluemosel its an mcc law so applies to all cricket  i guess individual leagues can at a local level but internationally not the case
305158133507055618,Sports,the warriors new uniforms tonight are fresh gt 
306011214759227392,Politics,like our ep xb panorama  clicks check making of video  clicks ep
302175102269784064,Politics,happening now president obama joins a firesidehangout live from the white house 
302751122408493056,Politics,president hollande speaks at indiafrance trade conference photo gallry  business standard 
266062679272198144,Politics,mitt romney delivering concession speech to supporters in boston potu
296644390636621824,Politics,indian author shortlisted for man booker prize  hindustan times 
293124214356078592,Sports,missed saturdays bigfinal dont worry we got you covered  bbl
304130216605937664,Politics,uclet us give practical recognition to the injustices of the past by building a future based on equality amp socialjusticeud madiba un
278858783818670080,Politics,the president we need to modernise our political system the government will seek to ensure political parties equal access to the media
306646774884470784,Sports,congrats to nicoalmagro for his th match win in acapulco the spaniards were on fire tuesday  atp
301215039719878656,Politics, february  nelsonmandela attends the robben island reunion conference
297589691706904576,Politics,rt ddnewslive watch live th mgnrega awards 
303173314715742210,Sports,rt mstarc outstanding world cup win southernstars girls nwwc cmonaussies
305705899299835904,Sports,a report on todays defeat away to manchester city  cfc
286377334381092864,Politics,arrived at visakhapatnam reviewed department of posts work in ap circle specifically wrt direct cash transferaadhar
296850471824547840,Politics,on jan  pm abe received request from issei nishikawa governor of fukui and others at the prime ministers officen
32686048047800320,Sports,andyinbrum cheers mate was just on way to bar
303631987988639744,Sports,vivienne 
304153441641570304,Sports,shortlists for the football league awards  will be announced at am this morning u  clubs have made the shortlists flawards
299183882585133056,Politics,medvedev the government recognises the need for disclosure of information open data is one way to improve communication between people
280532180655042560,Politics,video in english press conference by chief cabinet secretary fujimura december  amn
306473843726368768,Sports,bbcsport will be across all the uk bbcfootball action tonight as well as barca v madrid in elclasico 
306188136793395200,Sports,mozzie still believes australia can save the match in chennai you can watch his press conference here  indvaus
286038416469151744,Politics,create an atmosphere where you can move everybody towards the goal you have set for yourselfas well as the collective  which you work nm
304359380172828673,Sports,aldershot town announced the departure of manager dean holdsworth this evening rt officialshots club statement 
295517094706049024,Sports,djokovic does his lap of honour on rla pete ausopenfinal 
300546371319103488,Sports,gbfedcup outstanding fight from the british no  holds at love for one set all after  mins
298177041352757248,Sports,milosraonic clinches daviscup tie for canada against spain with a    victory over garcialopez atp tennis daviscup
303531513390182400,Sports, delpotrojuan has a surprise in store for his team watch this spycamera video on facebook  atp
306126217743048704,Sports,tonight we join whufcofficial in remembering one of the all time great footballers  bobby moore legend 
295518908943826946,Sports,djokovic the results are showing the kind of sensations i have when i play rod laver arenameant every word i saidlove this tournament
306471809375686657,Politics,obama the sequester uses a meatcleaver approach to gut critical investments in things like education amp national security jobsovercuts
305155235771457536,Sports,mccullum belatedly comes up with the first six of the game straight off swann new zealand need a few more of those nzveng
292126250582044672,Sports,poll on channel suggested kulasekera should bowl ten straight overs  said yes im estimating  have ever tried bowling ausvsl
24140978734,Sports,arsenal vs bolton bolton are unbeaten in  games for the first time in  years arsenal have not conceded at the emirates for nearly  hrs
296186267987738624,Politics,video in english press conference by chief cabinet secretary sugajanuary  pm
305991271686733824,Sports,st test over   run m henriques  n lyon  aus  indvaus  bcci
294379306140983296,Politics,pm right up on g agenda is tackling threat of extremism amp terrorism  working together and with countries worst affected by threat wef
306797416915546113,Sports,allenbcook one camera captured plenty
301244250429984768,Politics,one of pope benedicts lesserknown legacies a bold proposal for global financial reform 
305821023952056320,Sports,aus a side finch c burns voges ferguson rohrer paine hastings boyce hazlewood sandhu mcdermott butterworth th ausavengl
253932853237268480,Politics,i will create  million new jobs when barackobama couldnut itus time to get our country back on track 
306755639936442370,Politics,video elections in italy aircraft co emissions tougher approach to smoking start of the week in europarlen 
305081788752084994,Politics,more than  million records released  in september  the president announced thatfor the first time in hist 
300551487929593857,Sports,gbfedcup bulgaria breaks for the first time since last game of opening set gb still lead 
301465739968266242,Sports,tdhessi were finalising all our prizes now 
302415205630099457,Sports,read our guide to the daviscup and find out how you can get your tickets to watch gb live in april  gbdaviscup
306425302651899904,Politics,the caribbean nations of st kitts and nevis antigua and barbuda graduating from peacecorps 
304992136158408704,Sports,rt samsungfootball were running another great competition to fly with chelseafc to their game v steaua bucharest enter here  http 
300545340401135616,Sports,gbfedcup bulgaria holds for  still one break separates them watson serving to level the match
300944691468328960,Politics,finance ministry urges all tax payers to disclose their true income and pay due taxes for the current year
300152282891304960,Sports,gbfedcup hungary gets another break for 
305931970154729472,Sports,st test over   run d warner  e cowan  aus  indvaus  bcci
301901603877830656,Sports,rt mazdaaus and finally heres a video of the allnew mazda being tested for the ausgrandprix mazdacelebchallenge zoomzoom http 
298914201911566336,Sports,any contributions jptrophy for fans of orient southend coventry amp crewe lets have your onewordreview after tonights games jpt
305950407887310850,Politics,ratnadv true that 
22827095033913344,Sports,mijbender come on mate you cant beat factual pun based humour
301530264377634816,Politics,obama we may hold different views than the person beside us but as americans we all share the same proud title we are citizens sotu
306506516754726912,Sports,rt bbclsx the nd half is about to get underway as leicester lead blackburn  listen to the action now at  
268667343276756992,Politics,the president on the pension reform i think the proposed law should be approved but should not come into effect until january  
302375393808220160,Politics,iampb ministry conducts ucjamunia u tasveer badalte bharat kiud at kumbh mela details at 
305925910161408000,Sports,important wicket to johnhastings he traps vince lbw for  lions  needing  from  to win ausavengl
298332792385847296,Politics,at kandla port trust kpt was inaugurated by pandit nehru in  after we lost port of karachi in  
303899119162888192,Politics,to stop chinese hackers focus on defense not diplomacy adschina on staying safe in cyberspace 
304615059001331712,Sports,hashimamlafan the mcc made this decision
303953673799729152,Politics,i know that my students and i will carry these scars for the rest of our lives urachel s  theydeserveavote
305376387215278080,Politics,aalav thank you for understanding
303799519789862912,Sports,tomorrow and thursday the champions league and fa cup trophies will be in our kingston store cfc 
51302786293448704,Sports, again needing one to win of three balls donald and klusener other how to run and sa are bundled out in the semis
306089223918850048,Sports, off all nutrition at the official maximuscle shop for  days plus free delivery  february only 
299120394588286978,Sports,remembering those who died in amp after the munich air disaster  years ago today crew club staff journalists passengers amp these playersu
302806767916695552,Sports,results u winter cup finals sf gb  cze mikheeva won amp georgie axon lost amp axonkatie swan lost doubles amp play romania tomo
249902960988016640,Politics,if barackobama cannot lead his own party how can he lead america 
301902918670483456,Sports,bensweeneyf cute idea though 
292562506919075840,Politics, january  nelsonmandela and joe matthews fly to mbeya in tanzania then tanganyika
300944931323793409,Politics,rt pmoindia president pranab mukherjee and prime minister dr manmohan singh at the conference of governors at rashtrapati bhavan http 
277755508444782593,Politics,today sapresident zuma visited madiba in a pretoria hospital 
304145286324957185,Sports,england has defeated new zealand by eight wickets in the nd odi the series is now tied at  cricket
305932149159243776,Politics,brownbrumby same law of land should apply to all but not second  a
265934989449904128,Politics,itus time to turn the page on the last four years get your friends and family and go vote 
306144335664119808,Politics,rt usosce when internet freedom is challenged a range of human rights and fundamental freedoms are often at stake  
302459304944996352,Sports,i would give up everything now to go back amp play the game of basketball  michael jordan gt  via wrightthompson
292593585738641408,Politics,weekly address now is the time to take action against gun violence 
294097343320580098,Politics,medvedev russias possible development scenarios which were created by experts and presented at the davos forum are not wholly realistic
24763402412,Sports,ff
261166473832169472,Politics,together we will restore the promise of america 
305678065151930368,Sports,hazard is fouled by zabaleta and mata takes the resulting freekick which is cleared  mins played cfc
305280511910236161,Sports,goal  fulham tankovic taps home the rebound after an effort from outside the box cannons back off the bar cfcu
306001257728991232,Sports,adityamea yep very handy
24469897205,Sports,how do you feel the premierleague big guns will do tonight and tomorrow night in the championsleague
