TweetId,Label,cleaned_text
296544388220350464,Politics,the nelsonmandela centre of memory has been made aware of a new donor scam currently circulating via email 
305874940656238593,Sports,since acvoges was run out aus a has lost  with four overs to go the score is  tdpaine  and cajboyce  ausavengl
306308357717889024,Politics,amrutak please refer to the background on 
51302166824099840,Sports,and of course for those not up to speed with great saffer chokes
295543500106260481,Sports,rt sabinelisicki congrats to djokernole on winning rd aussie open title amazing it was a great amp fun final to watch gottal 
305358326936506368,Sports,rt sportscenter ol terron armstead   lbs ran an unofficial  in the yard dash wow sctop nflcombine
281255699227475969,Politics,video in english press conference by deputy chief cabinet secretary shiba december  am 
305977000445759489,Sports,buttigieg no its just a fun run
283784080812822528,Politics,following the general resignation of the cabinet today pm noda left the pms office as the staff bid him farewell early this afternoon
296766557227462656,Sports,thedjoker great to hear thanks for the feedback
266046034973712384,Politics,somber reaction to projected obama win at romney headquarters u potu
44409022874529792,Sports,england luckiest wc team ever
295530766480314369,Sports,djokovic i try to enjoy what i do every moment of life i have is a blessing im fortunate to have this opportunity and to succeed
305891651514159104,Sports,st test  j pattinson to ms dhoni b  runs  indvaus  bcci
304069331124355072,Sports,at collins place today giving u chance to win swissevitamins fxae seater ride at ausgp  come down for chance to win
299053210646241280,Politics,met the panama ambassador in delhi to discuss bilateral issues post my visit to panama last month 
302404876779020288,Sports,tell us who you think will score in the npowerchamp this week use fantasypicksu in your reply for a phonesu fantasy football shoutout
278520323773693953,Politics,senate and house democrats hold a presser at aet on the fiscal cliff live cnn signal is up now on ch 
304432821747998720,Sports,btw forgot to mention gavaskars telling reminder to todays millionaire cricketers that test cricket is still the pinnacle of the sport
299444726740967424,Politics,more eu funding for refugees in border states the way we handle asylum seekers is frankly unacceptable interview 
305244520285622272,Sports,joe root averages  after his first  odis his lowest score so far   nzveng odi series to england 
285843773894840320,Politics,happy new year
278540980481847296,Politics,enca apologises over  graca machel footage causing confusion over madiba health 
301811691237302272,Sports,mikedc good plan 
265950463952826368,Politics,with your help we will turn our country around and get america back on the path to prosperity please vote today 
304121467342290944,Sports,rt cricketworldcup how is planning going with  years to go until cwc take a look behind the scenes with cricket   
304644754111598593,Sports,pj it depends on the competition  free hits arent a law of the game
306340563689537536,Politics,a lawyers strike holds up hearing on charges against sajjan kumar in  riots one more banal reason to entangle justice in cobwebs of time
285612532570419200,Politics, december  nelsonmandela arrives in cape town on his first visit to south africaus mother city
292581190735646722,Sports,watch dan christian make six hitting look easy  bbl bigfinals
306253422728982530,Sports,st test over   runs n lyon  m henriques  aus  indvaus  bcci
306709096973864960,Politics,cea best form of inclusive growth is providing a good job need to provide more vocational training
306721644423041024,Politics,major news development varun gandhi is acquitted by the courts in one of two hatespeech cases second case verdict day after
294506272441655297,Politics,catch up with the days events at davos  wef
32645238250016768,Sports,hes surprisingly correct they love em ucjohnsuncricket bfinnobystander this is australia the land of rules and regs thats whyud
300186318720356352,Sports,gbfedcup another break for heatherwatson and team gb win the first set 
268165071430090752,Politics,vientiane declaration on strengthening partnership for peace and development is available from the following nov  
306797506421981184,Sports,reeced a bowl
302560295958749184,Politics,i spy 
306130680256028672,Politics,nandythegreatz  goodnight
266062596698951680,Politics,a picture of what might have been a defeated mitt romney joined by running mate paul ryan and their families onstage potu
306506505295917056,Sports,championship ht bolton  peterborough  bbcfootball
301693447260233728,Politics,on february  the president will hold talks with oecd secretarygeneral jose angel gurria trevino 
306090212017201152,Sports,csimac it seems alexhales would agree with you on the choice of jwd
266034415837270016,Politics,cnn projects obama wins reelection with more than  electoral votes u heres obamas thank you tweet potu
305683247596179457,Sports,half time here where its man city    chelsea cfc
299193538346905601,Politics,as britains links to china grow stronger pm sends best wishes to people around the world celebrating chinesenewyear 
300859282474299393,Politics, february  nelsonmandela released from victor verster prison in paarl with belongings including  boxes amp a surfboard freedom
301515879433265153,Politics,president obama ucafter years of grueling recession our businesses have created over six million new jobsud jobsnow
296677433896222720,Politics,a tad bit late but priyankachopras finally going where no indian has ever been the international charts our greatest soft power yet
304269227290918913,Politics,seckerry this is the time to engage this is not optional its a necessity
296291128326635523,Politics,indian tourist arrivals in south africa grow by   via bsindia
276848449620697088,Politics,tiffany shared what  meant to her  and the president stopped by to talk about it 
292575881967308800,Sports,out just as burns got going beer strikes the third wicket caught at long onoff out for    bbl bigfinals
301528774531506176,Politics,senators of both parties are working together on tough new laws to prevent anyone from buying guns for resale to criminals nowisthetime
287031471485624322,Sports,i had a little bet with most of the oreilly stand that hughes would get more than warner three balls later warner skies one to long off
289289884395528192,Politics,do read thembi fords oped in todays indianexpress pop culture is often the scapegoat for gendergun crimes when its really about us
306721785871740928,Sports,heres dembabafoot talking about his fa cup hopes ahead of tonights tie  cfc
278250365688881152,Politics,vice president biden talks myk over lunch  on friday afternoon seven middleclass americans with a personal  
306789123342086144,Sports,reeced if its rain affected they will use methods to decide the game as they would in other circumstances very rare
299675305407307776,Sports,check out the bbl superstars that will take the field against the west indies on wednesday night at the gabba 
304111011865174016,Sports,to clarify our last tweet englands target was a further  runs needed for victory when we posted our tweet new zealand made  ao
305950239238529024,Sports,indvaus clarke and warner are taking the attack to india aus 
303374542125027328,Sports,toinestin could you please send us an email at fansgrandprixcomau with your receipt no and we will look into it for you
34145316965978112,Sports,rt cvrse channel upto their old antics again switched channel wont be forced to watch your news ausveng lostadrevenue
300187957388791808,Sports,gbfedcup watson wins a fourth game in a row for  in the nd support from captain judmoo court side 
260104118763388930,Politics,according to barackobama you canut change washington from the inside but leaders find a way to get things done 
306118779514007553,Politics,fact automatic spending cuts would eliminate more than  million meals for sick and homebound seniors if congress doesnt act jobsnotcuts
296241361445855232,Politics,in february the government will read a draft programme on financial market development and establishment of an international finance centre
306799998841004032,Sports,hope you enjoyed our fl stats  for a recap of them plus a few more see 
268299402437881856,Politics,video in english press conference by chief cabinet secretary fujimura november  pm 
304664877337817090,Politics,if something can harm or kill tens of civilians in quick succession it does not belong in anyones home ucalvin a wedemandavote
301523548852342785,Politics,real reform means strong border security and we can build on the progress my administration has already made immigrationreform
305273830312669185,Sports,pakistan are now  for  their highest opening partnership of the series  savpak
306168018344480768,Sports,did you know the entire ausgp circuit comes together in  weeks check out this stepbystep guide co richardsf 
294023686632136704,Politics,pms remarks at conferment of s k singh award 
306666391522652160,Politics,eco survey expenditure on social services increased considerably in th plan education accounted for largest share followed by health
291475813168185344,Sports,beer into the attack starsbbl  bbl bigfinals
269067999967866880,Politics,video in english press conference by chief cabinet secretary fujimura november  pm
291521568172044290,Sports,leg bye  off  tense bbl bigfinals
286606508387610624,Politics, january  nelsonmandela attends a meeting which decides to send a delegate to a conference in ethiopia he is chosen to go
305037194639331328,Politics,horsemeat scandal  what can be done to ensure our food is  safe read our latest post 
306666343825035265,Politics,economic survey takes note of high level of gross npas of the banking sector suggests revival of growth will help contain npas
301682594293096448,Politics,sotu barackobama called for first ever transatlantic free trade agreement discuss pro amp cons on ep linkedin page 
305965839281160192,Sports,dylanlynchk did you win 
306733316852301824,Sports,which former avfcofficial amp whufcofficial striker is now on trial at inter milan  bbcsportsday
301371040225980416,Sports,glenn maxwell made a duck on the day he was bought by mumbai indians for a million usd and a duck in his first match on indian soilhmmm
292804276403728385,Politics,giving back on the national day of service  president barack obama stains shelves during a national day of serv 
294051752079159296,Politics,prime ministers question starts in  minutes  pmqs
304277310008348672,Politics,fact only  of inmates who used a handgun in a crime acquired it from a storeuwhich require background checks
248580402707562496,Politics,free people and free enterprise create growth and opportunity not government redistribution 
303935440761790465,Politics,my family deserves a vote we all deserve a vote usami on losing his father to gun violence  theydeserveavote
304269027092594689,Politics,rt usembassybbdos seckerry  million americanss lives are better because of what we do diplomacy
292594072592449536,Sports,out big wicket marsh is out caught hauritz off cutting out for   scorchersbbl   bbl bigfinals
302640383282798592,Sports,q how does johnisner squeeze his   frame into economy a with great difficulty  atp
304508488007184384,Politics,debate about euglobstrat with foreign min sikorskiradek amp carlbildt amp mep arnauddanjean live from am cet 
286191391938334720,Politics,what you need to know about the bipartisan tax agreement  president obama has repeatedly called this a makeor 
303083274790653952,Sports,sa tightening grip on test with  quick wickets this morning pak need at least  runs more from here  to make a match of it
305550914863902722,Sports,indvaus india   runs off the last lyon over by ms dhoni jpattinson continues
291106218334908416,Politics,rt mofajapanen ministry of foreign affairs of japan opened a facebook page please visit the page and click  asean nhttp 
306722011965706240,Sports,great scenes ryan harris gets mckay and fawad out in the last over vics bowled out for  queensland win the ryobi cup by  runs
306709369557499905,Sports,todays pmb tweet  describe in  words your reaction when di matteo scored v middlesbrough at wembley in cfcpmb
304966212067143680,Politics,today is the national day of action to reduce gun violence use wedemandavote to share why now is the time for congress to act
304464360741416960,Politics,khandm thanks i usually ignore confront at times
306465865728155649,Politics,seckerry and uk foreign sec williamjhague speaking to reporters at the uk fco  seckerryinuk
299924362155421697,Politics,the president has attended a meeting of the interior ministry board 
305320708878262273,Sports,rt capitalonecup there are  countries covering tomorrows capitalonecup final let us know if youll be watching from one of them 
301811962818465793,Sports,stewartmatthew thanks for that 
305615906111881217,Sports,indvaus drinks in the final session of day three australia have taken two wickets but dhoni is still at the crease india 
306716430278201344,Sports,pspanidis queenstown
306270163752325120,Sports,out sehwag is caught at slip by clarke off lyon good catch by the skipper out for   indvaus
303244519653138432,Sports,rt southf formulagame bernie
302840883018100736,Sports,rt amlahash one of the challenges of life is addressing our own hypocrisy and also handling the hypocrisy of others
305625156724867072,Sports,indvaus  overs down india   in front
283522683742875650,Politics,this morning sapresident jacob zuma visited nelson mandela in a pretoria hospital 
291509492758233088,Sports, after three  overs to go bbl bigfinals
276249212264517632,Politics,video in english press conference by chief cabinet secretary fujimura december  amn
299831933167345666,Sports,ucdanielricciardo hey guys for more  pics from jerez testing check out my website 
291137486535659520,Sports,one over left  needed  bbl bigfinals
289250983949774848,Politics,the struggle against apartheid can be typified as the pitting of memory against forgetting nelsonmandela
34094244167684097,Sports,ok now i have no idea what just happened long time followers will know i do not rate the drs so get ready for another whinge
289247178130587648,Politics, january  nelsonmandela notes in his prison calendar that the film the killing fields uviolentlyu upset him
304535069723344897,Politics,haroldholzer the battle at ft sumter was viewed in the eyes of the world and in the eyes of most other states as aggression by the south
295530321485635584,Sports,mh thanks a lot for following see you next year
300565617415712768,Sports,rt fedcup judmoo heatherwatson laurarobson elenabaltacha jokonta annekeothavong celebrate in eilat fedcup 
292582012236214276,Sports,precious four to hartley with time running out bbl bigfinals
286826116524683264,Politics,sorry not entirely true connectcoai no scientific evidence links telecom tower radiation with adverse health effects
306190168728158209,Politics,join us on instagram for the live photo feed of the bcim car rally at  bcim
304943588251430914,Sports,lewissrailway sorry lewis we cant comment on this right now
305937523669078016,Sports,indvaus  up for australia in tough conditions aus  from  overs
295507881845993473,Sports,djokernole captures th major title and rd straight australianopen with     win over andymurray 
283195703352770560,Politics,dmitry medvedev russian development institutions have invested over  billion rubles in the it industry in the past few years
299507073610309632,Sports,wheresjaimie answer  he was at burys gigg lane well done to all of you that got it  scottbrad was first and joins our winners list
306300277684858881,Sports,rt ferrarikid embracetherace ausgrandprix
302071708238626816,Politics,the nelsonmandela centre of memory offers condolences on the passing of phyllis naidoo 
304848126181789697,Sports, quick wickets postlunch swing pendulum indias waypitch treacherous amp ashwin looking deadly but if oz score  india cud be in danger
305894173456867328,Sports,st test over   run b kumar  ms dhoni  ind  indvaus  bcci
303870704904970240,Politics,by  the world population is expected to reach  billion people and demand for food will increase by  percent keepwhatureap
301689534373064705,Politics,pm recognises uks highly successful chinese community amp celebrates ukchina relations at chinesenewyear reception 
304217944215412736,Sports,benitez frank has been playing a lot of games managing the squad means we can keep fresh legs on the pitch cfc
306058867895308288,Sports,it is only  days to the start of the ct and we want you to help us put together the city guides for the event ctguide
304326181468119040,Sports,rt jptrophy in the other match the teams have gone in  at half time so crewe still  up on agg wembleys getting ever closer 
298686285109932032,Politics,one of the most difficult things is not to change society u but to change yourself nelsonmandela
306752935386304512,Sports,rt officialcsa csanews kyleabbott added to proteas odi squad 
304542808860131328,Politics,haroldholzer african slavery was the most hypocritical element of american liberty and was the primary issue in the election of 
294290755839725569,Sports,down under dominance bryanbros and bryanbrothers reach th australianopen doubles final in past  years  atp
305541045901463552,Sports,rt bcci st test  wicket s tendulkar is out b nathan lyon  indvaus  bcci
305530516780752896,Sports,do you think sachin tendulkar can complete his century against australia on sunday testcricket
306647754992676864,Politics, february  nelson mandela arrives in tunis tunisia on his clandestine trip to get support for the armed struggle
303793823371390976,Politics,rt pmoindia pm we have also decided to commence negotiations on a bilateral civil nuclear agreement 
302243407030538240,Politics,president obama high quality prek is good bang for your educational buck 
304357633807228928,Sports,nitrocircuslive have touched down in melbourne whosgettingexcited 
280544895947649024,Politics,president obama at prayer vigil for connecticut shooting victims newtown you are not alone 
274444821597396992,Sports,ozgooner merci swansea should be a good game to watch eh
304214306520702977,Sports,benitez no new injuries ahead of tomorrow just oriol still out cfc
304031250652463104,Sports,rt espncbb great first half in east lansing no  indiana leads no  michigan state  iuvsmichst
294381517499678720,Politics,pm we need more free trade fairer tax systems more transparency on how governments amp companies operate guk wef g
305083439500124161,Sports,after his qf win at copa claro davidferrer met guillecoria amp discussed junior tennis initiatives atp tennis 
295511243253501953,Sports,some player towel love for the fans ausopen djokovic pete 
302272961770045440,Politics,watch president obama answers your questions in a google hangout 
300195001789460480,Sports,our charity partner prostate cancer uk are offering you the chance to win tickets to the capitalonecup final  see prostateuk for more
292611036484341761,Sports,official postgame presentations getting under way here at the furnace bbl bigfinals
306010078337720321,Sports,stuartbroad is having a good time in new zealand 
304449248081104896,Sports,rt espncbb double overtime anyone lets go kuvsokst
305205276460589056,Sports,trott feathers an edge behind off tim southee and falls for  england still in total control on  for two nzveng
306540472648736769,Sports,rt mikedc the names are up  the ausgrandprix now we need cars and teams 
306670846930481152,Sports,james hopes gone now for a duck white with another catch as darren pattinson collects his nd wicket qld in trouble at  ryobiodc
299223834878431234,Sports,sanjooraja tku
304361294587375617,Politics,whitehouse fact sheet advancing rights of lgbt people globally  statedrl humanrightsgov
304464094080139265,Politics,anupakhanna such an ass
304096023758901249,Sports,shrivastavrahul its a closed door session
306480570928607233,Sports,bbcsport brings you all the breaking sports news on its new free smartphone app for iphone and android 
306081719377870849,Politics,japan is back says shinzo abe but dont expect that to mean much for his national security policy 
269146938765611008,Politics,as former cia dir gen david patraeus heads to the hill friday  well be live bookings open at pmet for liveshots from dc
305962670950055936,Sports,thanks to all that have helped take the rallyagainstcancer total past xa to dontate visit  aegonchampionships
276596451210063872,Politics,video in english press conference by chief cabinet secretary fujimura december  amn
300190765018124288,Sports,gbfedcup watson leads  second set with support from team mates 
300549743623430144,Sports,gbfedcup five games in a row for watson now  final set
297354032782131200,Politics,rt ukhomeoffice made to measure crime maps are live try them out   crimemaps
306308069422424065,Politics,enroute imphal rough amp adventurous terrain so far may lose network in the middle will update as soon as were back in range bcim
301481712318296066,Politics,heres the best place to watch president obamas sotu address tonight at pm et 
306615753686253568,Sports,rt westindies read the full reports of both series victories from the windies men amp women on 
303506672477933568,Politics,rt jduch sd hannesswoboda eubudget deal is unacceptablethere will be no majority for it in parliamentneed real modifications euco
292535169657741315,Sports,rt tipsarevicjanko mateall dayeveryday 
302198783171784704,Sports,rafaelnadal defeats souza   to win his opener at the brasilopen in sao paulo atp tennis
303557154772746241,Politics,rt thebrowser i thought generation kill was an ott title for this interview u but then they do talk a lot about killing  
300194197896589312,Sports,gbfedcup watson drops serve still leads  nd set
303880594927009793,Sports,rt espnstatsinfo tonights indiana vs michigan state game will be the first ever between the two schools with both ranked in the top  
305257402108895233,Politics,lynettesaimon thank you  and will try  not sure will succeed 
303548738583015424,Sports,tv selection leicester city v birmingham city has been selected for live coverage by skysports on friday  april pm ko tvgame
306089701985632256,Sports,asalam that would be a lonely dinner date
304605045930999808,Sports, blogs win or bust in hobart 
291476703245635585,Sports,powerplay complete starsbbl  hogg into the attack bbl bigfinals
295513398869909504,Sports,murray with the ausopen runners up trophy pete 
300583695734157312,Sports,wow weve reached  followers thanks for your support everyone
306666824865546240,Politics,economic survey free legal services benefit more than  lakh persons from st april  to st october 
305949433684709377,Sports,st test over   runs d warner  m clarke  aus  indvaus  bcci
306521331543990272,Sports,stay across the bbcfootball live text commentary for all the reaction and quotes from tonights matches 
305951606426443777,Politics,bhupendrachaube didnt check 
291485305050120192,Sports,bang six white is belting the scorchersbbl out of bbl with this brutal hitting   off the th bbl bigfinals
304723046713933824,Sports,ff chelscanlan our rockin ausgp ambassador for 
304072542635827200,Politics,video in english press conference the chief cabinet secretary suga february  amn
303066531380740096,Sports,daily tickets for the aegon international are on sale now get yours at  or by calling   
305678586881388545,Sports,brown revels in unexpected promotion 
282751396892250112,Politics,we have walked such a long road together sharing trials amp tribulations danger anguish amp fear and also precious moments of joy madiba
306167567293222912,Politics,share why your family cant afford severe spending cuts to vital services for kids and seniors  jobsnotcuts
293384127825195008,Politics,the pm has just finished updating ukparliament on the algeria hostage crisis read his statement here 
305660399011901440,Sports,celebrate the atps storied history and  years of the emirates atp rankings atpheritage  atp tennis
265888221282570241,Politics,together we can bring real change to this country help get out the vote 
293413994776129536,Politics,pres obama speaks about gay rights and about the need to address climate change pomo amp pomo
303747436520812544,Sports,england bowler stuart broad prepares for the next odi against new zealand cricket 
301229504444133376,Politics,statement by the prime minister of japan on the nuclear test by north korea february   n
304594744988811265,Sports,josephbarron let us know how it goes 
302968140395053058,Politics,khanshafayet the entire route is about kms from kolkata to kunming
303493281617170433,Politics,ep debates eucouncil decision to cut eubudget watch it live now n 
306620187556335616,Sports,rafaelnadal reaches abiertotelcel r after a   win over schwartzman  atp tennis
304096905519054848,Sports,aus xi for st test warner cowan hughes watson clarke capt wade wk henriques debut siddle starc pattinson lyon
303965977324949505,Politics,president obama automatic budget cuts will hurt economy slow recovery and put people out of work 
281381686325948416,Politics,csto summit military cooperation and the situation in afghanistan 
302512699206680576,Politics,iraqi woman visits us cities to learn how americans handle womenus issues  statealumni usembbaghdad
304614198942498816,Sports,richietamartin you currently get a refund based on a limited number of overs being bowled in the day
265976702100979712,Politics,live aerial shots of long voting lines in miami fl currently on ns ch   source wsvn
284648095772446721,Politics,law signed on the sanctions for violating human rights and liberties and the rights and freedoms of russian citizens 
301971216057638912,Politics,aagan please note flagoff is on  feb  salt lake stadium kolkata at  hrs for details log on to 
